names,Top_course,location,public/private,rating/5,fee_structure,entrance_text,other_course
Apollo Engineering College,BE Aeronautical Engineering,Poonamallee,Private,3.1,3.7,JEE,8.0
Apollo Institute of Engineering and Technology,Diploma in Computer Engineering,Ahmedabad,Private,4.0,1.0,JEE,4.0
Apollo Institute of Technology,B.Tech Computer Science and Engineering,Tiwaripur Salempur,Private,2.6,3.23,UPCET,7.0
Apollo Polytechnic College,Diploma in Electronics and Communication Engineering,Sethupet,Private,3.9539370078740155,3.7,JEE,6.0
Apollo Priyadarshanam Institute of Technology,BE Civil Engineering,Panruti,Private,3.9539370078740155,3.7,JEE,4.0
AIET Gulbarga - Appa Institute of Engineering and Technology,BE Energy Engineering,Kalaburagi,Private,3.9539370078740155,3.7,COMEDK,8.0
Appasaheb Birnale College of Architecture,B.Arch,Sangli,Private,3.9539370078740155,3.7,JEE,6.0
Applied College of Management and Engineering,B.Tech Mechanical Engineering,Aurangabad,Private,3.9539370078740155,2.6,JEE,4.0
APS College of Education and Technology,Diploma in Civil Engineering,Meerut,Private,3.9539370078740155,3.7,JEE,6.0
APS Bangalore - APS College of Engineering,B.Tech Computer Science and Engineering,Bangalore,Private,4.2,3.6,JEE,7.0
APSIT Thane - AP Shah Institute of Technology,BE Computer Engineering,Thane,Private,4.8,4.74,JEE,7.0
Apurva Polytechnic,Diploma in Civil Engineering,Selu,Private,3.9539370078740155,3.7,JEE,6.0
Aquinas College,B.Sc Electronics Self Finance,Kochi,Private,3.8,1.13,JEE,6.0
Arambagh Government Polytechnic,Diploma in Civil Engineering,Arambagh,Public,3.9539370078740155,3.7,JEE,6.0
Arasan Ganesan Polytechnic College,Diploma in Mechanical Engineering,A.Meenachipuram,Public,3.9539370078740155,3.7,JEE,6.0
Arasu Engineering College,BE Computer Science and Engineering,Kallappuliyur,Private,3.8,3.7,JEE,9.0
Arasu Polytechnic College,Diploma in Mechanical Engineering,Kallappuliyur,Private,3.9539370078740155,3.7,JEE,6.0
ACEM Faridabad - Aravali College of Engineering and Management,B.Tech Computer Science Engineering,Faridabad,Private,4.1,4.14,JEE,5.0
Aravali Institute of Technical Studies,Diploma in Civil Engineering,Eklingpura,Private,3.3,3.7,JEE,6.0
Aravindar Polytechnic College,Diploma in Automobile Engineering,Dindigul,Private,3.9539370078740155,3.7,JEE,6.0
Archana College of Engineering,B.Tech Mechanical Engineering,Alappuzha,Private,3.9539370078740155,3.3,JEE,5.0
Archana Institute of Technology,BE Civil Engineering,Nehru Puram,Private,5.0,3.7,JEE,7.0
AR College of Engineering and Technology,BE Automobile Engineering,Tirunelveli,Private,3.9539370078740155,3.7,JEE,7.0
AR Engineering College,BE Artificial Intelligence and Data Science,Villupuram,Private,3.9539370078740155,3.7,JEE,6.0
Arham Veerayatan Polytechnic Institute,Diploma in Electrical Engineering,Kutch,Private,3.9539370078740155,3.7,JEE,6.0
Aries Polytechnic College,Diploma in Automobile Engineering,Palakkad,Private,3.9539370078740155,3.7,JEE,6.0
Arifa Institute of Technology,B.Tech Artificial Intelligence and Data Science,Nagapattinam,Private,3.9539370078740155,3.7,JEE,5.0
Arifa Polytechnic College,Diploma in Electrical and Electronics Engineering,Nagapattinam,Private,3.9539370078740155,3.7,JEE,6.0
Arignar Anna Institute of Science and Technology,BE Electrical and Electronics Engineering,Kancheepuram,Private,3.0,3.7,JEE,6.0
Aringer Anna College of Engineering and Technology,BE Civil Engineering,Sriperumbudur,Private,3.9539370078740155,3.7,JEE,5.0
Ariyalur Engineering College,BE Computer Science and Engineering,Ariyalur,Private,3.5,3.7,JEE,5.0
ARJ College of Engineering and Technology,BE Computer Science and Engineering,Kannarappettai,Private,3.9539370078740155,3.7,JEE,8.0
ARJ Polytechnic College,Diploma in Mechanical Engineering,Thiruvarur,Private,3.9539370078740155,3.7,JEE,6.0
Arjun College of Technology and Sciences,Diploma in Computer Science and Engineering,Hyderabad,Private,3.3,3.7,JEE,5.0
Arjun College of Technology,BE Computer Science and Engineering,Coimbatore,Private,3.9539370078740155,3.7,JEE,8.0
ARKA Jain University,B.Tech Computer Science and Engineering,Jamshedpur,Private,4.3,5.3,JEE,6.0
Arkay College of Engineering and Technology,Diploma in Electrical and Electronics Engineering,Nizamabad,Private,3.9539370078740155,3.7,JEE,5.0
ARM College of Engineering and Technology,BE Mechanical Engineering,Chennai,Private,3.9539370078740155,3.7,JEE,8.0
AIT Pune - Army Institute of Technology,BE Information Technology,Pune,Private,4.2,8.62,JEE,4.0
Arni School of Technology,B.Tech Civil Engineering,Kangra,Private,3.9539370078740155,4.2,JEE,5.0
Arni University,B.Tech Artificial Intelligence Robotics,Kangra,Private,3.9539370078740155,4.21,JEE,5.0
ARPIT Institute of Engineering and Technology,Diploma in Chemical Engineering,Hadala,Private,3.9539370078740155,3.7,JEE,6.0
Arrdekta Institute of Technology,BE Civil Engineering,Khedbrahma,Private,5.0,3.7,GUJCET,7.0
ARS College of Engineering,BE Civil Engineering,Maraimalai Nagar,Private,3.9539370078740155,3.7,JEE,4.0
